{
  "fifa_code": "GER",
  "display_name": "Germany",
  "group": "E",
  "progression": {
    "p_group_qualification": 0.84,
    "p_r16": 0.66,
    "p_qf": 0.36,
    "p_sf": 0.18,
    "p_final": 0.09,
    "p_champion": 0.04,
    "ci_95_champion": [
      0.034,
      0.046
    ]
  },
  "history": [],
  "upcoming_matches": [
    {
      "match_id": "M09",
      "kickoff_utc": "2026-06-14T17:00:00Z",
      "opponent": "Curaçao",
      "is_home": true
    },
    {
      "match_id": "M33",
      "kickoff_utc": "2026-06-19T17:00:00Z",
      "opponent": "Côte d'Ivoire",
      "is_home": true
    },
    {
      "match_id": "M57",
      "kickoff_utc": "2026-06-24T17:00:00Z",
      "opponent": "Ecuador",
      "is_home": false
    }
  ]
}
